{
  "foldercast": 1,
  "generatedAt": "2026-10-05T10:00:00+08:00",

  "source": {
    "root": "/tmp/target"
  },

  "title": "夹具目录 · 导览",

  "scenes": [
    {
      "id": "cover",
      "type": "cover",
      "title": "夹具目录",
      "subtitle": "分析器的测试样本",
      "narration": "这是一个用来测分析器的小目录。",
      "durationSec": null
    },
    {
      "id": "entry",
      "type": "file",
      "title": "主入口",
      "narration": "主入口引用了工具函数。",
      "file": "src/index.ts",
      "focusLines": [1, 5],
      "durationSec": null
    },
    {
      "id": "outro",
      "type": "outro",
      "title": "完",
      "narration": "这就是它的全貌。",
      "durationSec": null
    }
  ]
}
