{
  "foldercast": 1,
  "generatedAt": "2026-10-04T17:30:00+08:00",

  "source": {
    "root": "/Users/scliang/work/qiuzhao202608/lecture-videos",
    "label": "lecture-videos"
  },

  "title": "lecture-videos · 导览",

  "scenes": [
    {
      "id": "cover",
      "type": "cover",
      "title": "lecture-videos",
      "subtitle": "数学基础讲解视频管线",
      "narration": "这是一个把数学讲义变成讲解视频的项目。它用 Remotion 渲染画面，用 TTS 生成旁白，目前已经产出了七讲样片。",
      "durationSec": null
    },
    {
      "id": "structure",
      "type": "tree",
      "title": "目录结构",
      "narration": "整个目录分成四块。content 放讲稿，scripts 放配音脚本，src 是渲染工程，public 存放图片和音频素材。",
      "highlight": ["content", "scripts", "src", "public"],
      "durationSec": null
    },
    {
      "id": "inventory",
      "type": "inventory",
      "title": "这里面有什么",
      "narration": "一共二十四个文件。其中 TypeScript 源码六个，讲稿和数据十个，图片四张，还有两个说明文档。",
      "groups": [
        { "kind": "code", "count": 6, "note": "Remotion 工程与 TTS 脚本" },
        { "kind": "data", "count": 10, "note": "七讲讲稿与时长清单" },
        { "kind": "image", "count": 4, "note": "notebook 跑出的结果图" },
        { "kind": "text", "count": 2, "note": "README 与说明" }
      ],
      "durationSec": null
    },
    {
      "id": "entry",
      "type": "file",
      "title": "主入口：Root.tsx",
      "narration": "Root.tsx 是整个渲染工程的入口，被四个文件引用。它注册了七个组合，每个组合对应一讲。它用 calculateMetadata 从时长清单里累加总帧数，所以改文案不需要手动对时间轴。",
      "file": "src/Root.tsx",
      "asset": "assets/code/src_Root_tsx.png",
      "focusLines": [40, 62],
      "durationSec": null
    },
    {
      "id": "tts",
      "type": "file",
      "title": "配音：tts.py",
      "narration": "配音脚本支持两个供应商，Edge TTS 和 MiMo TTS，可以随时切换。它还做了断点续跑，已经合成过的音频会跳过。",
      "file": "scripts/tts.py",
      "asset": "assets/code/scripts_tts_py.png",
      "durationSec": null
    },
    {
      "id": "results",
      "type": "gallery",
      "title": "notebook 跑出的结果图",
      "narration": "这些是讲稿里引用的结果图，由 numpy 跑出来，直接嵌进视频。",
      "items": [
        "assets/thumbs/math01_eig.png",
        "assets/thumbs/math02_clt.png",
        "assets/thumbs/math04_gd_traj.png"
      ],
      "durationSec": null
    },
    {
      "id": "outro",
      "type": "outro",
      "title": "完",
      "narration": "这就是这个目录的全貌。它是一条完整的管线：讲稿进，成片出。",
      "durationSec": null
    }
  ]
}
